{
  "schema": "vega/test-lanes@1",
  "note": "The lane registry (BUILD-PLAN §4.8; D6 §3). A lane is declared here and proved by what its run observed (lanes/<id>/observed.json), never by this file. Budgets are 1.5 x the measured wall time rounded up to 30 s (D6 §16.5), and each stage share holds 1.5 x the slowest measured stage of its group (size_budgets.py, T12): measured on the release run of 2026-10-09 (every lane through page, -j 6, CPU, 2 threads per lane, machine load about 44 on 20 cores; runs/final/T12) and the final run's earlier lane runs; G00 keeps its estimate until it runs.",
  "defaults": {
    "threads": 2,
    "n_boot": 200,
    "max_epochs": 8,
    "patience": 3,
    "budget_s": {
      "core": 150,
      "full": 300
    },
    "allowed_skips": [
      "non-finite values",
      "digit-code column",
      "monitor reference",
      "no wheel could be built",
      "code column with a pattern",
      "packed with --no-inspect"
    ],
    "forbidden_skip_patterns": [
      "cannot be shown",
      "dense chain",
      "view cannot",
      "not available",
      "no presets"
    ],
    "stage_shares": {
      "fixture": 0.08,
      "forge": 0.1,
      "train": 0.2,
      "eval": 0.12,
      "pack": 0.1,
      "bundle_api": 0.28,
      "report": 0.01,
      "show": 0.1,
      "serve": 0.03,
      "serve_check": 0.04,
      "inspect": 0.05,
      "page": 0.11
    },
    "acceptance_shares": {
      "forge": 0.15,
      "train": 0.22,
      "eval": 0.15,
      "pack": 0.23,
      "bundle_api": 0.06,
      "report": 0.01,
      "show": 0.05,
      "serve": 0.02,
      "serve_check": 0.03,
      "inspect": 0.03,
      "page": 0.06
    },
    "golden_shares": {
      "golden": 0.55,
      "serve": 0.05,
      "serve_check": 0.1,
      "inspect": 0.1,
      "page": 0.2
    },
    "stage_timeout_factor": 2,
    "lane_kill_factor": 2,
    "budget_warn_factor": 1.25,
    "jobs": 6,
    "adaptation_pairs": [
      "L02:L01",
      "L10:L02",
      "L02:G00"
    ]
  },
  "lanes": [
    {
      "id": "L01",
      "title": "late orders, residual MLP (the acceptance chain)",
      "driver": "acceptance",
      "generator": "orders",
      "variant": null,
      "seed": 7,
      "rows": 740,
      "rows_unit": "row",
      "entity": "Order",
      "family": "mlp-residual",
      "task": "binary",
      "goal": "predict",
      "shape": "row",
      "target": {
        "column": "late",
        "classes": [
          "0",
          "1"
        ],
        "base": null,
        "positive": "1",
        "quantiles": null,
        "label_format": null,
        "sep": null,
        "anomaly_rate": null,
        "source": "geometry:partitions/late",
        "class_names": {
          "0": "on time",
          "1": "late"
        }
      },
      "window": null,
      "graph": null,
      "blocks": [
        {
          "id": "B1",
          "type": "embedding",
          "params": {
            "columns": [
              "zip",
              "region"
            ],
            "dims": {
              "zip": 12,
              "region": 4
            }
          }
        },
        {
          "id": "B2",
          "type": "concat",
          "params": {}
        },
        {
          "id": "B2b",
          "type": "dense",
          "params": {
            "units": 64,
            "activation": "none"
          }
        },
        {
          "id": "B3",
          "type": "residual",
          "params": {
            "repeat": 2,
            "projection": "auto",
            "inner": [
              {
                "type": "dense",
                "params": {
                  "units": 64,
                  "activation": "none"
                }
              },
              {
                "type": "batchnorm",
                "params": {}
              },
              {
                "type": "activation",
                "params": {
                  "name": "gelu"
                }
              },
              {
                "type": "dropout",
                "params": {
                  "p": 0.2
                }
              }
            ]
          }
        },
        {
          "id": "B4",
          "type": "head",
          "params": {
            "out": 1,
            "activation": "none"
          }
        }
      ],
      "loss": {
        "name": "bce_with_logits",
        "params": {
          "pos_weight": 4.9
        }
      },
      "optimizer": "adamw",
      "schedule": "cosine",
      "init": "kaiming_uniform",
      "serving_mode": "batch+serve",
      "campaign": {
        "rungs": [
          "R0",
          "R1",
          "R6"
        ],
        "hpo_trials": 5,
        "expect_floor": "linear"
      },
      "report": "stub",
      "roles": {
        "0": "neutral",
        "1": "alert"
      },
      "stances": [
        "show: roles alert = 1 (user)"
      ],
      "lexicon": {
        "target": {
          "one": "delivery outcome",
          "many": "delivery outcomes",
          "article": "a"
        },
        "row": {
          "one": "order",
          "many": "orders",
          "article": "an"
        },
        "feature": {
          "one": "input",
          "many": "inputs",
          "article": "an"
        },
        "source": {
          "one": "order system",
          "many": "order systems",
          "article": "the"
        }
      },
      "service_title": "Late order detector",
      "profile": "full",
      "tiers": [
        "pr",
        "release",
        "nightly"
      ],
      "adaptation": "reference",
      "expect": {
        "motif": "points"
      },
      "budget_s": 690
    },
    {
      "id": "L02",
      "title": "land cover from spectral bands, plain MLP",
      "driver": "lanekit",
      "generator": "landcover",
      "variant": null,
      "seed": 1,
      "rows": 1800,
      "rows_unit": "row",
      "entity": "Parcel",
      "family": "mlp-plain",
      "task": "multiclass",
      "goal": "predict",
      "shape": "row",
      "target": {
        "column": "cover",
        "classes": [
          "water",
          "forest",
          "grassland",
          "cropland",
          "urban",
          "bare"
        ],
        "base": null,
        "positive": null,
        "quantiles": null,
        "label_format": null,
        "sep": null,
        "anomaly_rate": null
      },
      "window": null,
      "graph": null,
      "blocks": [
        {
          "id": "B1",
          "type": "dense",
          "params": {
            "units": 64,
            "activation": "none"
          }
        },
        {
          "id": "B2",
          "type": "activation",
          "params": {
            "name": "gelu"
          }
        },
        {
          "id": "B3",
          "type": "dropout",
          "params": {
            "p": 0.1
          }
        },
        {
          "id": "B4",
          "type": "dense",
          "params": {
            "units": 64,
            "activation": "none"
          }
        },
        {
          "id": "B5",
          "type": "activation",
          "params": {
            "name": "gelu"
          }
        },
        {
          "id": "B6",
          "type": "dropout",
          "params": {
            "p": 0.1
          }
        },
        {
          "id": "B7",
          "type": "head",
          "params": {
            "out": 6,
            "activation": "none"
          }
        }
      ],
      "loss": {
        "name": "cross_entropy",
        "params": {
          "label_smoothing": 0.05
        }
      },
      "optimizer": "adamw",
      "schedule": "cosine",
      "init": "kaiming_uniform",
      "serving_mode": "online",
      "campaign": {
        "rungs": [
          "R0",
          "R1"
        ],
        "hpo_trials": 2,
        "expect_floor": "linear"
      },
      "report": "stub",
      "roles": {
        "water": "plain",
        "forest": "plain",
        "grassland": "plain",
        "cropland": "plain",
        "urban": "plain",
        "bare": "plain"
      },
      "stances": [],
      "lexicon": {
        "row": {
          "one": "parcel",
          "many": "parcels",
          "article": "a"
        },
        "feature": {
          "one": "band",
          "many": "bands",
          "article": "a"
        },
        "source": {
          "one": "satellite survey",
          "many": "satellite surveys",
          "article": "the"
        }
      },
      "service_title": "Land cover classifier",
      "profile": "full",
      "tiers": [
        "pr",
        "release",
        "nightly"
      ],
      "adaptation": "domain",
      "expect": {
        "motif": "points",
        "real_subchain": true
      },
      "budget_s": 420
    },
    {
      "id": "L03",
      "title": "support tickets, FT-Transformer multilabel",
      "driver": "lanekit",
      "generator": "tickets",
      "variant": null,
      "seed": 1,
      "rows": 1200,
      "rows_unit": "row",
      "entity": "Ticket",
      "family": "ft-transformer",
      "task": "multilabel",
      "goal": "predict",
      "shape": "row",
      "target": {
        "column": "tags",
        "classes": [
          "billing",
          "bug",
          "account",
          "shipping"
        ],
        "base": null,
        "positive": null,
        "quantiles": null,
        "label_format": "delimited",
        "sep": "|",
        "anomaly_rate": null
      },
      "window": null,
      "graph": null,
      "blocks": [
        {
          "id": "B1",
          "type": "feature_tokenizer",
          "params": {
            "d": 32
          }
        },
        {
          "id": "B2",
          "type": "transformer_encoder",
          "params": {
            "d": 32,
            "heads": 4,
            "layers": 2,
            "ff": 64,
            "dropout": 0.1
          }
        },
        {
          "id": "B3",
          "type": "pool",
          "params": {
            "kind": "cls"
          }